{
  "id": "44444444-4444-4444-8444-444444444444",
  "scope": {
    "owner_id": "11111111-1111-4111-8111-111111111111",
    "continuity_id": "55555555-5555-4555-8555-555555555555",
    "branch_id": "66666666-6666-4666-8666-666666666666"
  },
  "schema_version": "1.0.0",
  "revision": 1,
  "created_at": "2026-09-05T00:00:00Z",
  "updated_at": "2026-09-05T00:00:00Z",
  "source_release_id": "33333333-3333-4333-8333-333333333333",
  "resolved_definition_hash": "aaaaaaaaaaaaaaaaaaaaaaaaaaaaaaaaaaaaaaaaaaaaaaaaaaaaaaaaaaaaaaaa"
}
